{
  "schemaVersion": "1.0.0",
  "family": "judgment",
  "catalogStatus": "unresolved",
  "description": "传统断课有限输入清单；尚无《指南》页级规则可批准。",
  "expectedEntryCount": 9,
  "entries": [
    {
      "ruleId": "dlr.rule.judgment.001.course-pattern",
      "family": "judgment",
      "subfamily": "judgmentInput",
      "ordinal": 1,
      "traditionalName": "课体基调",
      "adoptedStatus": "pending",
      "conditionsSummary": "保留九宗门、课经与毕法命中为独立因素，不用中文名称充当执行键。",
      "prioritySummary": "同规则族内的优先关系尚未由影印页冻结；不得按目录顺序推断执行优先级。",
      "interpretation": "这是后续《指南》逐页规则研究的有限输入面；当前不定义确定性传统 verdict predicate。",
      "evidenceLevel": "C",
      "locatorOnly": true,
      "executableApproved": false,
      "sourceRefs": [
        {
          "sourceId": "dlr.source.cunyan-transcription-d2a44794",
          "referenceKind": "locator",
          "volume": null,
          "scanLeaf": null,
          "printedLeaf": null,
          "pdfPage": null,
          "imageLabel": null,
          "locator": "六壬存验-清-吴师青.txt:L355-L390",
          "shortQuote": "课例以课体、三传、天将、年命等多项事实合参。",
          "verifiedBy": []
        }
      ],
      "variantGroupId": null,
      "adoptedVariantId": null,
      "fixtureIds": [],
      "targetCapabilityId": "daliuren.judgment.course-pattern",
      "targetCodeDomain": "lib/domain/services/daliuren/analysis/",
      "notes": []
    },
    {
      "ruleId": "dlr.rule.judgment.002.host-guest",
      "family": "judgment",
      "subfamily": "judgmentInput",
      "ordinal": 2,
      "traditionalName": "干支主客",
      "adoptedStatus": "pending",
      "conditionsSummary": "日干与日支及其上神分别作为人／事或主／客事实，适用语义由占类限定。",
      "prioritySummary": "同规则族内的优先关系尚未由影印页冻结；不得按目录顺序推断执行优先级。",
      "interpretation": "这是后续《指南》逐页规则研究的有限输入面；当前不定义确定性传统 verdict predicate。",
      "evidenceLevel": "C",
      "locatorOnly": true,
      "executableApproved": false,
      "sourceRefs": [
        {
          "sourceId": "dlr.source.cunyan-transcription-d2a44794",
          "referenceKind": "locator",
          "volume": null,
          "scanLeaf": null,
          "printedLeaf": null,
          "pdfPage": null,
          "imageLabel": null,
          "locator": "六壬存验-清-吴师青.txt:L355-L390",
          "shortQuote": "课例以课体、三传、天将、年命等多项事实合参。",
          "verifiedBy": []
        }
      ],
      "variantGroupId": null,
      "adoptedVariantId": null,
      "fixtureIds": [],
      "targetCapabilityId": "daliuren.judgment.host-guest",
      "targetCodeDomain": "lib/domain/services/daliuren/analysis/",
      "notes": []
    },
    {
      "ruleId": "dlr.rule.judgment.003.transmission-flow",
      "family": "judgment",
      "subfamily": "judgmentInput",
      "ordinal": 3,
      "traditionalName": "三传始终与递生递克",
      "adoptedStatus": "pending",
      "conditionsSummary": "分别观察初中末传及递生、递克、入墓、空亡；相反因素可并存。",
      "prioritySummary": "同规则族内的优先关系尚未由影印页冻结；不得按目录顺序推断执行优先级。",
      "interpretation": "这是后续《指南》逐页规则研究的有限输入面；当前不定义确定性传统 verdict predicate。",
      "evidenceLevel": "C",
      "locatorOnly": true,
      "executableApproved": false,
      "sourceRefs": [
        {
          "sourceId": "dlr.source.cunyan-transcription-d2a44794",
          "referenceKind": "locator",
          "volume": null,
          "scanLeaf": null,
          "printedLeaf": null,
          "pdfPage": null,
          "imageLabel": null,
          "locator": "六壬存验-清-吴师青.txt:L355-L390",
          "shortQuote": "课例以课体、三传、天将、年命等多项事实合参。",
          "verifiedBy": []
        }
      ],
      "variantGroupId": null,
      "adoptedVariantId": null,
      "fixtureIds": [],
      "targetCapabilityId": "daliuren.judgment.transmission-flow",
      "targetCodeDomain": "lib/domain/services/daliuren/analysis/",
      "notes": []
    },
    {
      "ruleId": "dlr.rule.judgment.004.generals",
      "family": "judgment",
      "subfamily": "judgmentInput",
      "ordinal": 4,
      "traditionalName": "天将因素",
      "adoptedStatus": "pending",
      "conditionsSummary": "天将只作为有来源的因素，不在事实层直接翻转总裁决。",
      "prioritySummary": "同规则族内的优先关系尚未由影印页冻结；不得按目录顺序推断执行优先级。",
      "interpretation": "这是后续《指南》逐页规则研究的有限输入面；当前不定义确定性传统 verdict predicate。",
      "evidenceLevel": "C",
      "locatorOnly": true,
      "executableApproved": false,
      "sourceRefs": [
        {
          "sourceId": "dlr.source.cunyan-transcription-d2a44794",
          "referenceKind": "locator",
          "volume": null,
          "scanLeaf": null,
          "printedLeaf": null,
          "pdfPage": null,
          "imageLabel": null,
          "locator": "六壬存验-清-吴师青.txt:L355-L390",
          "shortQuote": "课例以课体、三传、天将、年命等多项事实合参。",
          "verifiedBy": []
        }
      ],
      "variantGroupId": null,
      "adoptedVariantId": null,
      "fixtureIds": [],
      "targetCapabilityId": "daliuren.judgment.generals",
      "targetCodeDomain": "lib/domain/services/daliuren/analysis/",
      "notes": []
    },
    {
      "ruleId": "dlr.rule.judgment.005.shensha",
      "family": "judgment",
      "subfamily": "judgmentInput",
      "ordinal": 5,
      "traditionalName": "神煞因素",
      "adoptedStatus": "pending",
      "conditionsSummary": "只消费 C00/C06 已批准且 typed 位置可匹配的神煞；未核项不输出确定性标签。",
      "prioritySummary": "同规则族内的优先关系尚未由影印页冻结；不得按目录顺序推断执行优先级。",
      "interpretation": "这是后续《指南》逐页规则研究的有限输入面；当前不定义确定性传统 verdict predicate。",
      "evidenceLevel": "C",
      "locatorOnly": true,
      "executableApproved": false,
      "sourceRefs": [
        {
          "sourceId": "dlr.source.cunyan-transcription-d2a44794",
          "referenceKind": "locator",
          "volume": null,
          "scanLeaf": null,
          "printedLeaf": null,
          "pdfPage": null,
          "imageLabel": null,
          "locator": "六壬存验-清-吴师青.txt:L355-L390",
          "shortQuote": "课例以课体、三传、天将、年命等多项事实合参。",
          "verifiedBy": []
        }
      ],
      "variantGroupId": null,
      "adoptedVariantId": null,
      "fixtureIds": [],
      "targetCapabilityId": "daliuren.judgment.shensha",
      "targetCodeDomain": "lib/domain/services/daliuren/analysis/",
      "notes": []
    },
    {
      "ruleId": "dlr.rule.judgment.006.class-spirit",
      "family": "judgment",
      "subfamily": "judgmentInput",
      "ordinal": 6,
      "traditionalName": "类神因素",
      "adoptedStatus": "pending",
      "conditionsSummary": "按用户确认占类与类神候选链解释，不由自由文本静默确定。",
      "prioritySummary": "同规则族内的优先关系尚未由影印页冻结；不得按目录顺序推断执行优先级。",
      "interpretation": "这是后续《指南》逐页规则研究的有限输入面；当前不定义确定性传统 verdict predicate。",
      "evidenceLevel": "C",
      "locatorOnly": true,
      "executableApproved": false,
      "sourceRefs": [
        {
          "sourceId": "dlr.source.cunyan-transcription-d2a44794",
          "referenceKind": "locator",
          "volume": null,
          "scanLeaf": null,
          "printedLeaf": null,
          "pdfPage": null,
          "imageLabel": null,
          "locator": "六壬存验-清-吴师青.txt:L355-L390",
          "shortQuote": "课例以课体、三传、天将、年命等多项事实合参。",
          "verifiedBy": []
        }
      ],
      "variantGroupId": null,
      "adoptedVariantId": null,
      "fixtureIds": [],
      "targetCapabilityId": "daliuren.judgment.class-spirit",
      "targetCodeDomain": "lib/domain/services/daliuren/analysis/",
      "notes": []
    },
    {
      "ruleId": "dlr.rule.judgment.007.nianming",
      "family": "judgment",
      "subfamily": "judgmentInput",
      "ordinal": 7,
      "traditionalName": "本命行年因素",
      "adoptedStatus": "pending",
      "conditionsSummary": "仅在个人上下文足量且规则版本明确时加入；缺失时显式降级。",
      "prioritySummary": "同规则族内的优先关系尚未由影印页冻结；不得按目录顺序推断执行优先级。",
      "interpretation": "这是后续《指南》逐页规则研究的有限输入面；当前不定义确定性传统 verdict predicate。",
      "evidenceLevel": "C",
      "locatorOnly": true,
      "executableApproved": false,
      "sourceRefs": [
        {
          "sourceId": "dlr.source.cunyan-transcription-d2a44794",
          "referenceKind": "locator",
          "volume": null,
          "scanLeaf": null,
          "printedLeaf": null,
          "pdfPage": null,
          "imageLabel": null,
          "locator": "六壬存验-清-吴师青.txt:L355-L390",
          "shortQuote": "课例以课体、三传、天将、年命等多项事实合参。",
          "verifiedBy": []
        }
      ],
      "variantGroupId": null,
      "adoptedVariantId": null,
      "fixtureIds": [],
      "targetCapabilityId": "daliuren.judgment.nianming",
      "targetCodeDomain": "lib/domain/services/daliuren/analysis/",
      "notes": []
    },
    {
      "ruleId": "dlr.rule.judgment.008.adjudication",
      "family": "judgment",
      "subfamily": "judgmentInput",
      "ordinal": 8,
      "traditionalName": "相反证据裁决",
      "adoptedStatus": "pending",
      "conditionsSummary": "保留吉凶相反因素、来源、适用条件与优先级；不依赖服务调用或列表顺序。",
      "prioritySummary": "同规则族内的优先关系尚未由影印页冻结；不得按目录顺序推断执行优先级。",
      "interpretation": "这是后续《指南》逐页规则研究的有限输入面；当前不定义确定性传统 verdict predicate。",
      "evidenceLevel": "D",
      "locatorOnly": true,
      "executableApproved": false,
      "sourceRefs": [],
      "variantGroupId": null,
      "adoptedVariantId": null,
      "fixtureIds": [],
      "targetCapabilityId": "daliuren.judgment.adjudication",
      "targetCodeDomain": "lib/domain/services/daliuren/analysis/",
      "notes": []
    },
    {
      "ruleId": "dlr.rule.judgment.009.project-heuristic",
      "family": "judgment",
      "subfamily": "judgmentInput",
      "ordinal": 9,
      "traditionalName": "项目启发式隔离",
      "adoptedStatus": "pending",
      "conditionsSummary": "项目 v1/v2 启发式与古籍规则使用不同 rule kind 和 evidence，不伪装成传统唯一断法。",
      "prioritySummary": "同规则族内的优先关系尚未由影印页冻结；不得按目录顺序推断执行优先级。",
      "interpretation": "这是后续《指南》逐页规则研究的有限输入面；当前不定义确定性传统 verdict predicate。",
      "evidenceLevel": "D",
      "locatorOnly": true,
      "executableApproved": false,
      "sourceRefs": [],
      "variantGroupId": null,
      "adoptedVariantId": null,
      "fixtureIds": [],
      "targetCapabilityId": "daliuren.judgment.project-heuristic",
      "targetCodeDomain": "lib/domain/services/daliuren/analysis/",
      "notes": []
    }
  ]
}
