{
  "schemaVersion": "1.0.0",
  "family": "nianming",
  "catalogStatus": "unresolved",
  "description": "本命/行年的有限输入与事实清单；算法口径未获影印页批准。",
  "expectedEntryCount": 8,
  "entries": [
    {
      "ruleId": "dlr.rule.nianming.001.birth-pillar",
      "family": "nianming",
      "subfamily": "requiredInput",
      "ordinal": 1,
      "traditionalName": "本命出生年柱",
      "adoptedStatus": "pending",
      "conditionsSummary": "保存明确的出生年干支；只有公历年份且无岁首口径时不得伪造年柱。",
      "prioritySummary": "同规则族内的优先关系尚未由影印页冻结；不得按目录顺序推断执行优先级。",
      "interpretation": "这是实现本命/行年所需的显式输入契约；传统采用法尚须《指南》影印页冻结。",
      "evidenceLevel": "D",
      "locatorOnly": true,
      "executableApproved": false,
      "sourceRefs": [],
      "variantGroupId": null,
      "adoptedVariantId": null,
      "fixtureIds": [],
      "targetCapabilityId": "daliuren.nianming.birth-pillar",
      "targetCodeDomain": "lib/domain/services/daliuren/",
      "notes": []
    },
    {
      "ruleId": "dlr.rule.nianming.002.birth-date",
      "family": "nianming",
      "subfamily": "requiredInput",
      "ordinal": 2,
      "traditionalName": "精确出生日期",
      "adoptedStatus": "pending",
      "conditionsSummary": "若采用法依赖岁首或年龄边界，保存可校历的出生日期与时区；缺失时显式 unknown。",
      "prioritySummary": "同规则族内的优先关系尚未由影印页冻结；不得按目录顺序推断执行优先级。",
      "interpretation": "这是实现本命/行年所需的显式输入契约；传统采用法尚须《指南》影印页冻结。",
      "evidenceLevel": "D",
      "locatorOnly": true,
      "executableApproved": false,
      "sourceRefs": [],
      "variantGroupId": null,
      "adoptedVariantId": null,
      "fixtureIds": [],
      "targetCapabilityId": "daliuren.nianming.birth-date",
      "targetCodeDomain": "lib/domain/services/daliuren/",
      "notes": []
    },
    {
      "ruleId": "dlr.rule.nianming.003.sex",
      "family": "nianming",
      "subfamily": "requiredInput",
      "ordinal": 3,
      "traditionalName": "性别输入",
      "adoptedStatus": "pending",
      "conditionsSummary": "只有核定的行年法确实使用性别时才要求该字段；不从姓名或文本猜测。",
      "prioritySummary": "同规则族内的优先关系尚未由影印页冻结；不得按目录顺序推断执行优先级。",
      "interpretation": "这是实现本命/行年所需的显式输入契约；传统采用法尚须《指南》影印页冻结。",
      "evidenceLevel": "D",
      "locatorOnly": true,
      "executableApproved": false,
      "sourceRefs": [],
      "variantGroupId": null,
      "adoptedVariantId": null,
      "fixtureIds": [],
      "targetCapabilityId": "daliuren.nianming.sex",
      "targetCodeDomain": "lib/domain/services/daliuren/",
      "notes": []
    },
    {
      "ruleId": "dlr.rule.nianming.004.age-method",
      "family": "nianming",
      "subfamily": "requiredInput",
      "ordinal": 4,
      "traditionalName": "年龄算法",
      "adoptedStatus": "pending",
      "conditionsSummary": "明确周岁、虚岁及换岁边界；计算结果必须携带算法 ID。",
      "prioritySummary": "同规则族内的优先关系尚未由影印页冻结；不得按目录顺序推断执行优先级。",
      "interpretation": "这是实现本命/行年所需的显式输入契约；传统采用法尚须《指南》影印页冻结。",
      "evidenceLevel": "D",
      "locatorOnly": true,
      "executableApproved": false,
      "sourceRefs": [],
      "variantGroupId": null,
      "adoptedVariantId": null,
      "fixtureIds": [],
      "targetCapabilityId": "daliuren.nianming.age-method",
      "targetCodeDomain": "lib/domain/services/daliuren/",
      "notes": []
    },
    {
      "ruleId": "dlr.rule.nianming.005.year-boundary",
      "family": "nianming",
      "subfamily": "requiredInput",
      "ordinal": 5,
      "traditionalName": "岁首口径",
      "adoptedStatus": "pending",
      "conditionsSummary": "明确立春、正月初一或底本规定的换岁点；不得随历法库默认值静默变化。",
      "prioritySummary": "同规则族内的优先关系尚未由影印页冻结；不得按目录顺序推断执行优先级。",
      "interpretation": "这是实现本命/行年所需的显式输入契约；传统采用法尚须《指南》影印页冻结。",
      "evidenceLevel": "D",
      "locatorOnly": true,
      "executableApproved": false,
      "sourceRefs": [],
      "variantGroupId": null,
      "adoptedVariantId": null,
      "fixtureIds": [],
      "targetCapabilityId": "daliuren.nianming.year-boundary",
      "targetCodeDomain": "lib/domain/services/daliuren/",
      "notes": []
    },
    {
      "ruleId": "dlr.rule.nianming.006.cast-year",
      "family": "nianming",
      "subfamily": "requiredInput",
      "ordinal": 6,
      "traditionalName": "所占年份",
      "adoptedStatus": "pending",
      "conditionsSummary": "以规范化占时确定所占年柱，供行年计算；raw pillars 模式缺时间时要求显式输入。",
      "prioritySummary": "同规则族内的优先关系尚未由影印页冻结；不得按目录顺序推断执行优先级。",
      "interpretation": "这是实现本命/行年所需的显式输入契约；传统采用法尚须《指南》影印页冻结。",
      "evidenceLevel": "D",
      "locatorOnly": true,
      "executableApproved": false,
      "sourceRefs": [],
      "variantGroupId": null,
      "adoptedVariantId": null,
      "fixtureIds": [],
      "targetCapabilityId": "daliuren.nianming.cast-year",
      "targetCodeDomain": "lib/domain/services/daliuren/",
      "notes": []
    },
    {
      "ruleId": "dlr.rule.nianming.007.benming-fact",
      "family": "nianming",
      "subfamily": "derivedFact",
      "ordinal": 7,
      "traditionalName": "本命事实",
      "adoptedStatus": "pending",
      "conditionsSummary": "足量输入与采用法齐备时计算本命；信息不足返回 unknown 而非沿用 inert birthYear。",
      "prioritySummary": "同规则族内的优先关系尚未由影印页冻结；不得按目录顺序推断执行优先级。",
      "interpretation": "《六壬存验》课例反复使用本命/行年作为判断上下文，但固定转录不足以确定完整算法。",
      "evidenceLevel": "C",
      "locatorOnly": true,
      "executableApproved": false,
      "sourceRefs": [
        {
          "sourceId": "dlr.source.cunyan-transcription-d2a44794",
          "referenceKind": "locator",
          "volume": null,
          "scanLeaf": null,
          "printedLeaf": null,
          "pdfPage": null,
          "imageLabel": null,
          "locator": "六壬存验-清-吴师青.txt:L357-L390",
          "shortQuote": "课例盘面同时记录年命或行年并参与断语。",
          "verifiedBy": []
        }
      ],
      "variantGroupId": null,
      "adoptedVariantId": null,
      "fixtureIds": [],
      "targetCapabilityId": "daliuren.nianming.benming-fact",
      "targetCodeDomain": "lib/domain/services/daliuren/",
      "notes": []
    },
    {
      "ruleId": "dlr.rule.nianming.008.xingnian-fact",
      "family": "nianming",
      "subfamily": "derivedFact",
      "ordinal": 8,
      "traditionalName": "行年事实",
      "adoptedStatus": "pending",
      "conditionsSummary": "按采用的性别、年龄与岁首规则计算行年，并记录所有输入和规则版本。",
      "prioritySummary": "同规则族内的优先关系尚未由影印页冻结；不得按目录顺序推断执行优先级。",
      "interpretation": "《六壬存验》课例反复使用本命/行年作为判断上下文，但固定转录不足以确定完整算法。",
      "evidenceLevel": "C",
      "locatorOnly": true,
      "executableApproved": false,
      "sourceRefs": [
        {
          "sourceId": "dlr.source.cunyan-transcription-d2a44794",
          "referenceKind": "locator",
          "volume": null,
          "scanLeaf": null,
          "printedLeaf": null,
          "pdfPage": null,
          "imageLabel": null,
          "locator": "六壬存验-清-吴师青.txt:L357-L390",
          "shortQuote": "课例盘面同时记录年命或行年并参与断语。",
          "verifiedBy": []
        }
      ],
      "variantGroupId": null,
      "adoptedVariantId": null,
      "fixtureIds": [],
      "targetCapabilityId": "daliuren.nianming.xingnian-fact",
      "targetCodeDomain": "lib/domain/services/daliuren/",
      "notes": []
    }
  ]
}
