{
  "schemaVersion": "1.0.0",
  "family": "timing",
  "catalogStatus": "locatorOnly",
  "description": "传统应期候选与现代日期解析的有限清单。",
  "expectedEntryCount": 8,
  "entries": [
    {
      "ruleId": "dlr.rule.timing.001.scale-by-calendar-context",
      "family": "timing",
      "subfamily": "scale",
      "ordinal": 1,
      "traditionalName": "年月日时尺度",
      "adoptedStatus": "pending",
      "conditionsSummary": "按问题与发用所值岁、月、旬、日、候等上下文选择尺度，不把地支候选固定解释为最近一日。",
      "prioritySummary": "同规则族内的优先关系尚未由影印页冻结；不得按目录顺序推断执行优先级。",
      "interpretation": "固定转录列出岁、月、旬、日、气候的应验层次，具体优先级仍须影印核页。",
      "evidenceLevel": "C",
      "locatorOnly": true,
      "executableApproved": false,
      "sourceRefs": [
        {
          "sourceId": "dlr.source.daquan-transcription-aa7bc942",
          "referenceKind": "locator",
          "volume": null,
          "scanLeaf": null,
          "printedLeaf": null,
          "pdfPage": null,
          "imageLabel": null,
          "locator": "docs/六壬大全/007巻七 课经集（一）.md:L73-L91",
          "shortQuote": "日应日，时应时……取年月日时为应期。",
          "verifiedBy": []
        }
      ],
      "variantGroupId": null,
      "adoptedVariantId": null,
      "fixtureIds": [],
      "targetCapabilityId": "daliuren.timing.scale",
      "targetCodeDomain": "lib/domain/services/daliuren/analysis/daliuren_ying_qi_service.dart",
      "notes": []
    },
    {
      "ruleId": "dlr.rule.timing.002.initial-transmission",
      "family": "timing",
      "subfamily": "candidate",
      "ordinal": 2,
      "traditionalName": "发用值期",
      "adoptedStatus": "pending",
      "conditionsSummary": "把初传所值支或干作为条件候选，保留来源 rule ID 与适用尺度。",
      "prioritySummary": "同规则族内的优先关系尚未由影印页冻结；不得按目录顺序推断执行优先级。",
      "interpretation": "只生成条件窗口，不单独翻转 verdict。",
      "evidenceLevel": "C",
      "locatorOnly": true,
      "executableApproved": false,
      "sourceRefs": [
        {
          "sourceId": "dlr.source.daquan-transcription-aa7bc942",
          "referenceKind": "locator",
          "volume": null,
          "scanLeaf": null,
          "printedLeaf": null,
          "pdfPage": null,
          "imageLabel": null,
          "locator": "docs/六壬大全/007巻七 课经集（一）.md:L73",
          "shortQuote": "若正月建寅，用起功曹，则事应正月之内。",
          "verifiedBy": []
        }
      ],
      "variantGroupId": null,
      "adoptedVariantId": null,
      "fixtureIds": [],
      "targetCapabilityId": "daliuren.timing.initialTransmission",
      "targetCodeDomain": "lib/domain/services/daliuren/analysis/daliuren_ying_qi_service.dart",
      "notes": []
    },
    {
      "ruleId": "dlr.rule.timing.003.terminal-transmission",
      "family": "timing",
      "subfamily": "candidate",
      "ordinal": 3,
      "traditionalName": "末传归结值期",
      "adoptedStatus": "pending",
      "conditionsSummary": "末传作为归结候选，必须与初中传路径及空亡条件同时报告。",
      "prioritySummary": "同规则族内的优先关系尚未由影印页冻结；不得按目录顺序推断执行优先级。",
      "interpretation": "候选理由与尺度不可只保存一个地支。",
      "evidenceLevel": "C",
      "locatorOnly": true,
      "executableApproved": false,
      "sourceRefs": [
        {
          "sourceId": "dlr.source.daquan-transcription-aa7bc942",
          "referenceKind": "locator",
          "volume": null,
          "scanLeaf": null,
          "printedLeaf": null,
          "pdfPage": null,
          "imageLabel": null,
          "locator": "docs/六壬大全/007巻七 课经集（一）.md:L45",
          "shortQuote": "末传为归结。",
          "verifiedBy": []
        }
      ],
      "variantGroupId": null,
      "adoptedVariantId": null,
      "fixtureIds": [],
      "targetCapabilityId": "daliuren.timing.terminalTransmission",
      "targetCodeDomain": "lib/domain/services/daliuren/analysis/daliuren_ying_qi_service.dart",
      "notes": []
    },
    {
      "ruleId": "dlr.rule.timing.004.kongwang-fill",
      "family": "timing",
      "subfamily": "candidate",
      "ordinal": 4,
      "traditionalName": "空亡填实／出旬",
      "adoptedStatus": "pending",
      "conditionsSummary": "只有裁决条件允许等待填实时，才按出旬或值支生成候选；明确无解条件不得同时产生解救窗口。",
      "prioritySummary": "同规则族内的优先关系尚未由影印页冻结；不得按目录顺序推断执行优先级。",
      "interpretation": "《存验》失马例以出旬填实断期，但仍是 C 级转录课例。",
      "evidenceLevel": "C",
      "locatorOnly": true,
      "executableApproved": false,
      "sourceRefs": [
        {
          "sourceId": "dlr.source.cunyan-transcription-d2a44794",
          "referenceKind": "locator",
          "volume": null,
          "scanLeaf": null,
          "printedLeaf": null,
          "pdfPage": null,
          "imageLabel": null,
          "locator": "六壬存验-清-吴师青.txt:L631-L636",
          "shortQuote": "必俟出旬乙巳日填实，方能得马也。",
          "verifiedBy": []
        }
      ],
      "variantGroupId": null,
      "adoptedVariantId": null,
      "fixtureIds": [],
      "targetCapabilityId": "daliuren.timing.kongWangFill",
      "targetCodeDomain": "lib/domain/services/daliuren/analysis/daliuren_ying_qi_service.dart",
      "notes": []
    },
    {
      "ruleId": "dlr.rule.timing.005.yima",
      "family": "timing",
      "subfamily": "candidate",
      "ordinal": 5,
      "traditionalName": "驿马动期",
      "adoptedStatus": "pending",
      "conditionsSummary": "驿马命中且事类相关时生成动期候选，并保留是否空墓及所临地盘。",
      "prioritySummary": "同规则族内的优先关系尚未由影印页冻结；不得按目录顺序推断执行优先级。",
      "interpretation": "驿马不等于无条件发生；空墓会改变候选条件。",
      "evidenceLevel": "C",
      "locatorOnly": true,
      "executableApproved": false,
      "sourceRefs": [
        {
          "sourceId": "dlr.source.cunyan-transcription-d2a44794",
          "referenceKind": "locator",
          "volume": null,
          "scanLeaf": null,
          "printedLeaf": null,
          "pdfPage": null,
          "imageLabel": null,
          "locator": "六壬存验-清-吴师青.txt:L781-L787",
          "shortQuote": "亥为巳日之驿马……应于丙戌日到。",
          "verifiedBy": []
        }
      ],
      "variantGroupId": null,
      "adoptedVariantId": null,
      "fixtureIds": [],
      "targetCapabilityId": "daliuren.timing.yiMa",
      "targetCodeDomain": "lib/domain/services/daliuren/analysis/daliuren_ying_qi_service.dart",
      "notes": []
    },
    {
      "ruleId": "dlr.rule.timing.006.chong-he",
      "family": "timing",
      "subfamily": "candidate",
      "ordinal": 6,
      "traditionalName": "冲动与合期",
      "adoptedStatus": "pending",
      "conditionsSummary": "伏吟、入墓或静象可在有证据的冲动／合住条件下生成候选；理由不得只用显示文本。",
      "prioritySummary": "同规则族内的优先关系尚未由影印页冻结；不得按目录顺序推断执行优先级。",
      "interpretation": "冲与合是候选条件，不是统一的确定性应期。",
      "evidenceLevel": "D",
      "locatorOnly": true,
      "executableApproved": false,
      "sourceRefs": [],
      "variantGroupId": null,
      "adoptedVariantId": null,
      "fixtureIds": [],
      "targetCapabilityId": "daliuren.timing.chongHe",
      "targetCodeDomain": "lib/domain/services/daliuren/analysis/daliuren_ying_qi_service.dart",
      "notes": []
    },
    {
      "ruleId": "dlr.rule.timing.007.calendar-resolution",
      "family": "timing",
      "subfamily": "calendar",
      "ordinal": 7,
      "traditionalName": "候选落实际日期",
      "adoptedStatus": "pending",
      "conditionsSummary": "使用占时瞬时值、IANA 时区与尺度把干支候选解析为可重复的日期窗口。",
      "prioritySummary": "同规则族内的优先关系尚未由影印页冻结；不得按目录顺序推断执行优先级。",
      "interpretation": "这是现代历法产品契约，不声称古籍提供 IANA 时区算法。",
      "evidenceLevel": "D",
      "locatorOnly": true,
      "executableApproved": false,
      "sourceRefs": [],
      "variantGroupId": null,
      "adoptedVariantId": null,
      "fixtureIds": [],
      "targetCapabilityId": "daliuren.timing.calendarResolution",
      "targetCodeDomain": "lib/domain/services/daliuren/analysis/daliuren_ying_qi_service.dart",
      "notes": []
    },
    {
      "ruleId": "dlr.rule.timing.008.no-verdict-override",
      "family": "timing",
      "subfamily": "contract",
      "ordinal": 8,
      "traditionalName": "应期不翻转裁决",
      "adoptedStatus": "pending",
      "conditionsSummary": "应期只表达条件窗口；不得单独把凶转吉、把无解改成可解或覆盖 verdict condition。",
      "prioritySummary": "同规则族内的优先关系尚未由影印页冻结；不得按目录顺序推断执行优先级。",
      "interpretation": "这是消除跨层互斥输出的项目契约，证据等级 D。",
      "evidenceLevel": "D",
      "locatorOnly": true,
      "executableApproved": false,
      "sourceRefs": [],
      "variantGroupId": null,
      "adoptedVariantId": null,
      "fixtureIds": [],
      "targetCapabilityId": "daliuren.timing.noVerdictOverride",
      "targetCodeDomain": "lib/domain/services/daliuren/analysis/",
      "notes": []
    }
  ]
}
