{
  "schemaVersion": "1.0.0",
  "family": "derivedFacts",
  "catalogStatus": "locatorOnly",
  "description": "旬空、遁干、旺相与日干关系的有限事实目录。",
  "expectedEntryCount": 6,
  "entries": [
    {
      "ruleId": "dlr.rule.derived-facts.001.xun-context",
      "family": "derivedFacts",
      "subfamily": "xun",
      "ordinal": 1,
      "traditionalName": "六旬旬首",
      "adoptedStatus": "pending",
      "conditionsSummary": "由日柱或显式采用的时柱确定所属六旬与旬首。",
      "prioritySummary": "同规则族内的优先关系尚未由影印页冻结；不得按目录顺序推断执行优先级。",
      "interpretation": "旬上下文必须记录采用日旬还是时旬，不能只输出展示词。",
      "evidenceLevel": "D",
      "locatorOnly": true,
      "executableApproved": false,
      "sourceRefs": [],
      "variantGroupId": null,
      "adoptedVariantId": null,
      "fixtureIds": [],
      "targetCapabilityId": "daliuren.derivedFacts.xunContext",
      "targetCodeDomain": "lib/domain/services/daliuren/",
      "notes": [
        "当前只冻结软件所需事实边界，影印规则 locus 未核。"
      ]
    },
    {
      "ruleId": "dlr.rule.derived-facts.002.kongwang",
      "family": "derivedFacts",
      "subfamily": "xun",
      "ordinal": 2,
      "traditionalName": "旬空",
      "adoptedStatus": "pending",
      "conditionsSummary": "每旬缺出的两支为空亡；采用的旬轴必须随事实保存。",
      "prioritySummary": "同规则族内的优先关系尚未由影印页冻结；不得按目录顺序推断执行优先级。",
      "interpretation": "空亡是客观派生事实，填实或喜惧另由分析与应期规则解释。",
      "evidenceLevel": "C",
      "locatorOnly": true,
      "executableApproved": false,
      "sourceRefs": [
        {
          "sourceId": "dlr.source.daquan-transcription-aa7bc942",
          "referenceKind": "locator",
          "volume": null,
          "scanLeaf": null,
          "printedLeaf": null,
          "pdfPage": null,
          "imageLabel": null,
          "locator": "docs/六壬大全/011巻十一 《毕法赋》上.md:L95-L99",
          "shortQuote": "旬内空亡逐类推。",
          "verifiedBy": []
        }
      ],
      "variantGroupId": null,
      "adoptedVariantId": null,
      "fixtureIds": [],
      "targetCapabilityId": "daliuren.derivedFacts.kongWang",
      "targetCodeDomain": "lib/domain/services/daliuren/",
      "notes": []
    },
    {
      "ruleId": "dlr.rule.derived-facts.003.transmission-dungan",
      "family": "derivedFacts",
      "subfamily": "dunGan",
      "ordinal": 3,
      "traditionalName": "三传旬遁干",
      "adoptedStatus": "pending",
      "conditionsSummary": "在采用的六旬上下文中，为初中末传各自地支配旬遁天干；无干位置显式为空。",
      "prioritySummary": "同规则族内的优先关系尚未由影印页冻结；不得按目录顺序推断执行优先级。",
      "interpretation": "旬遁干、天盘干与天干寄宫必须使用不同 typed 字段。",
      "evidenceLevel": "D",
      "locatorOnly": true,
      "executableApproved": false,
      "sourceRefs": [],
      "variantGroupId": null,
      "adoptedVariantId": null,
      "fixtureIds": [],
      "targetCapabilityId": "daliuren.derivedFacts.transmissionDunGan",
      "targetCodeDomain": "lib/domain/services/daliuren/",
      "notes": []
    },
    {
      "ruleId": "dlr.rule.derived-facts.004.wangxiang-five-states",
      "family": "derivedFacts",
      "subfamily": "strength",
      "ordinal": 4,
      "traditionalName": "旺相休囚死五态",
      "adoptedStatus": "pending",
      "conditionsSummary": "依据月令与五行关系为每个课传事实标记旺、相、休、囚、死之一。",
      "prioritySummary": "同规则族内的优先关系尚未由影印页冻结；不得按目录顺序推断执行优先级。",
      "interpretation": "五态是事实，不可压缩为 isWangXiang 布尔值或直接作为最终吉凶。",
      "evidenceLevel": "C",
      "locatorOnly": true,
      "executableApproved": false,
      "sourceRefs": [
        {
          "sourceId": "dlr.source.daquan-transcription-aa7bc942",
          "referenceKind": "locator",
          "volume": null,
          "scanLeaf": null,
          "printedLeaf": null,
          "pdfPage": null,
          "imageLabel": null,
          "locator": "docs/六壬大全/007巻七 课经集（一）.md:L73-L91",
          "shortQuote": "旺气言官职……相气论……死、囚、休气。",
          "verifiedBy": []
        }
      ],
      "variantGroupId": null,
      "adoptedVariantId": null,
      "fixtureIds": [],
      "targetCapabilityId": "daliuren.derivedFacts.strength",
      "targetCodeDomain": "lib/domain/services/daliuren/",
      "notes": []
    },
    {
      "ruleId": "dlr.rule.derived-facts.005.six-relations",
      "family": "derivedFacts",
      "subfamily": "relations",
      "ordinal": 5,
      "traditionalName": "三传六亲",
      "adoptedStatus": "pending",
      "conditionsSummary": "以每传五行相对日干五行派生父母、兄弟、子孙、妻财、官鬼。",
      "prioritySummary": "同规则族内的优先关系尚未由影印页冻结；不得按目录顺序推断执行优先级。",
      "interpretation": "六亲关系必须对初中末传对称产出，并保留原始五行关系。",
      "evidenceLevel": "C",
      "locatorOnly": true,
      "executableApproved": false,
      "sourceRefs": [
        {
          "sourceId": "dlr.source.daquan-transcription-aa7bc942",
          "referenceKind": "locator",
          "volume": null,
          "scanLeaf": null,
          "printedLeaf": null,
          "pdfPage": null,
          "imageLabel": null,
          "locator": "docs/六壬大全/010巻十 课经集（四）.md:L769",
          "shortQuote": "凡课俱取初传动爻，以别五行六亲、物类亲疏。",
          "verifiedBy": []
        }
      ],
      "variantGroupId": null,
      "adoptedVariantId": null,
      "fixtureIds": [
        "dlr.case.zhinan.gengyin-gengchen-ma-lianzhuang"
      ],
      "targetCapabilityId": "daliuren.derivedFacts.sixRelations",
      "targetCodeDomain": "lib/domain/services/daliuren/",
      "notes": []
    },
    {
      "ruleId": "dlr.rule.derived-facts.006.five-element-relation-to-day-stem",
      "family": "derivedFacts",
      "subfamily": "relations",
      "ordinal": 6,
      "traditionalName": "每传对日干五行关系",
      "adoptedStatus": "pending",
      "conditionsSummary": "每传分别记录生我、我生、克我、我克、同我；六合等旁系事实另列。",
      "prioritySummary": "同规则族内的优先关系尚未由影印页冻结；不得按目录顺序推断执行优先级。",
      "interpretation": "六合不得覆盖实际克身关系，事实层允许多关系并存。",
      "evidenceLevel": "D",
      "locatorOnly": true,
      "executableApproved": false,
      "sourceRefs": [],
      "variantGroupId": null,
      "adoptedVariantId": null,
      "fixtureIds": [],
      "targetCapabilityId": "daliuren.derivedFacts.relationToDayStem",
      "targetCodeDomain": "lib/domain/services/daliuren/",
      "notes": []
    }
  ]
}
